{
  "$schema": "https://json-schema.org/draft/2020-12/schema",
  "$id": "https://ai-video-maker/schema/manifesto.llm.schema.json",
  "title": "Manifesto de Video (subset para LLM)",
  "description": "Subset do schema de validacao, sem constraints numericas ou de tamanho. Entregue ao LLM para geracao de saida estruturada. Este schema e um relaxamento do manifesto.schema.json — TODO dado valido aqui tambem e valido no schema completo (a reciproca nao e verdadeira).",
  "type": "object",
  "additionalProperties": false,
  "required": [
    "schema_version",
    "fps",
    "width",
    "height",
    "nos",
    "cenas"
  ],
  "properties": {
    "schema_version": {
      "const": "Manifesto.1"
    },
    "fps": {
      "type": "integer",
      "default": 30
    },
    "width": {
      "type": "integer",
      "default": 1920
    },
    "height": {
      "type": "integer",
      "default": 1080
    },
    "duracao_total_frames": {
      "type": "integer"
    },
    "nos": {
      "type": "array",
      "items": {
        "$ref": "#/$defs/No"
      }
    },
    "cenas": {
      "type": "array",
      "items": {
        "$ref": "#/$defs/Cena"
      }
    },
    "audio": {
      "$ref": "#/$defs/Audio"
    }
  },
  "$defs": {
    "No": {
      "description": "No visual — uniao discriminada por anyOf + const no campo type",
      "anyOf": [
        {
          "$ref": "#/$defs/NoCabecalho"
        },
        {
          "$ref": "#/$defs/NoTexto"
        },
        {
          "$ref": "#/$defs/NoLista"
        },
        {
          "$ref": "#/$defs/NoMidia"
        },
        {
          "$ref": "#/$defs/NoCodigo"
        },
        {
          "$ref": "#/$defs/NoGrafico"
        }
      ]
    },
    "NoBase": {
      "type": "object",
      "required": [
        "id",
        "schema",
        "type",
        "duracao_frames"
      ],
      "properties": {
        "id": {
          "type": "string"
        },
        "schema": {
          "type": "string"
        },
        "type": {
          "type": "string"
        },
        "duracao_frames": {
          "type": "integer"
        },
        "entrada_frames": {
          "type": "integer",
          "default": 0
        },
        "animacao": {
          "$ref": "#/$defs/Animacao"
        }
      }
    },
    "Animacao": {
      "type": "object",
      "additionalProperties": false,
      "required": [
        "tipo"
      ],
      "properties": {
        "tipo": {
          "type": "string",
          "enum": [
            "fade",
            "slide",
            "scale",
            "spring",
            "none"
          ]
        },
        "direcao": {
          "type": "string",
          "enum": [
            "from-left",
            "from-right",
            "from-top",
            "from-bottom"
          ]
        },
        "duracao_frames": {
          "type": "integer"
        },
        "configuracao_mola": {
          "$ref": "#/$defs/ConfiguracaoMola"
        }
      }
    },
    "ConfiguracaoMola": {
      "type": "object",
      "additionalProperties": false,
      "required": [
        "damping",
        "stiffness"
      ],
      "properties": {
        "damping": {
          "type": "number"
        },
        "stiffness": {
          "type": "number"
        },
        "mass": {
          "type": "number",
          "default": 1
        }
      }
    },
    "NoCabecalho": {
      "type": "object",
      "allOf": [
        {
          "$ref": "#/$defs/NoBase"
        },
        {
          "properties": {
            "type": {
              "const": "cabecalho"
            },
            "schema": {
              "const": "Cabecalho.1"
            },
            "texto": {
              "type": "string"
            },
            "subtitulo": {
              "type": "string"
            },
            "alinhamento": {
              "type": "string",
              "enum": [
                "esquerda",
                "centro",
                "direita"
              ],
              "default": "centro"
            }
          },
          "required": [
            "texto"
          ]
        }
      ],
      "unevaluatedProperties": false
    },
    "NoTexto": {
      "type": "object",
      "allOf": [
        {
          "$ref": "#/$defs/NoBase"
        },
        {
          "properties": {
            "type": {
              "const": "texto"
            },
            "schema": {
              "const": "Texto.1"
            },
            "texto": {
              "type": "string"
            },
            "destaque": {
              "type": "boolean",
              "default": false
            },
            "alinhamento": {
              "type": "string",
              "enum": [
                "esquerda",
                "centro",
                "direita"
              ],
              "default": "esquerda"
            }
          },
          "required": [
            "texto"
          ]
        }
      ],
      "unevaluatedProperties": false
    },
    "NoLista": {
      "type": "object",
      "allOf": [
        {
          "$ref": "#/$defs/NoBase"
        },
        {
          "properties": {
            "type": {
              "const": "lista"
            },
            "schema": {
              "const": "Lista.1"
            },
            "itens": {
              "type": "array",
              "items": {
                "type": "string"
              }
            },
            "ordenada": {
              "type": "boolean",
              "default": false
            },
            "alinhamento": {
              "type": "string",
              "enum": [
                "esquerda",
                "centro",
                "direita"
              ],
              "default": "esquerda"
            }
          },
          "required": [
            "itens"
          ]
        }
      ],
      "unevaluatedProperties": false
    },
    "NoMidia": {
      "type": "object",
      "allOf": [
        {
          "$ref": "#/$defs/NoBase"
        },
        {
          "properties": {
            "type": {
              "const": "midia"
            },
            "schema": {
              "const": "Midia.1"
            },
            "hash": {
              "type": "string"
            },
            "tipo_midia": {
              "type": "string",
              "enum": [
                "imagem",
                "video",
                "gif"
              ]
            },
            "ajuste": {
              "type": "string",
              "enum": [
                "cover",
                "contain",
                "fill",
                "none"
              ],
              "default": "cover"
            },
            "texto_alternativo": {
              "type": "string"
            },
            "licenca": {
              "type": "string"
            }
          },
          "required": [
            "hash",
            "tipo_midia",
            "licenca"
          ]
        }
      ],
      "unevaluatedProperties": false
    },
    "NoCodigo": {
      "type": "object",
      "allOf": [
        {
          "$ref": "#/$defs/NoBase"
        },
        {
          "properties": {
            "type": {
              "const": "codigo"
            },
            "schema": {
              "const": "Codigo.1"
            },
            "codigo": {
              "type": "string"
            },
            "linguagem": {
              "type": "string",
              "default": "text"
            },
            "linhas_destaque": {
              "type": "array",
              "items": {
                "type": "integer"
              }
            },
            "nome_arquivo": {
              "type": "string"
            }
          },
          "required": [
            "codigo",
            "linguagem"
          ]
        }
      ],
      "unevaluatedProperties": false
    },
    "NoGrafico": {
      "type": "object",
      "allOf": [
        {
          "$ref": "#/$defs/NoBase"
        },
        {
          "properties": {
            "type": {
              "const": "grafico"
            },
            "schema": {
              "const": "Grafico.1"
            },
            "tipo_grafico": {
              "type": "string",
              "enum": [
                "barras",
                "linha",
                "pizza",
                "area",
                "dispersao"
              ]
            },
            "titulo": {
              "type": "string"
            },
            "dados": {
              "type": "array",
              "items": {
                "type": "object",
                "additionalProperties": false,
                "required": [
                  "rotulo",
                  "valor"
                ],
                "properties": {
                  "rotulo": {
                    "type": "string"
                  },
                  "valor": {
                    "type": "number"
                  },
                  "cor": {
                    "type": "string"
                  }
                }
              }
            }
          },
          "required": [
            "tipo_grafico",
            "dados"
          ]
        }
      ],
      "unevaluatedProperties": false
    },
    "Cena": {
      "type": "object",
      "additionalProperties": false,
      "required": [
        "id",
        "nos"
      ],
      "properties": {
        "id": {
          "type": "string"
        },
        "nos": {
          "type": "array",
          "items": {
            "type": "string"
          }
        },
        "transicao_entrada": {
          "$ref": "#/$defs/Transicao"
        },
        "transicao_saida": {
          "$ref": "#/$defs/Transicao"
        },
        "audio_cena": {
          "$ref": "#/$defs/AudioCena"
        }
      }
    },
    "Transicao": {
      "type": "object",
      "additionalProperties": false,
      "required": [
        "tipo",
        "duracao_frames"
      ],
      "properties": {
        "tipo": {
          "type": "string",
          "enum": [
            "slide",
            "fade",
            "wipe",
            "flip",
            "clockWipe",
            "cube",
            "none"
          ]
        },
        "duracao_frames": {
          "type": "integer"
        },
        "direcao": {
          "type": "string",
          "enum": [
            "from-left",
            "from-right",
            "from-top",
            "from-bottom"
          ]
        },
        "timing": {
          "$ref": "#/$defs/TimingMola"
        }
      }
    },
    "TimingMola": {
      "type": "object",
      "additionalProperties": false,
      "required": [
        "kind"
      ],
      "properties": {
        "kind": {
          "const": "spring"
        },
        "config": {
          "$ref": "#/$defs/ConfiguracaoMola"
        }
      }
    },
    "Audio": {
      "type": "object",
      "additionalProperties": false,
      "required": [
        "trilha_sonora"
      ],
      "properties": {
        "trilha_sonora": {
          "type": "string"
        },
        "volume": {
          "type": "number",
          "default": 0.3
        },
        "inicio_frames": {
          "type": "integer",
          "default": 0
        }
      }
    },
    "AudioCena": {
      "type": "object",
      "additionalProperties": false,
      "required": [
        "hash_locucao"
      ],
      "properties": {
        "hash_locucao": {
          "type": "string"
        },
        "volume": {
          "type": "number",
          "default": 1.0
        },
        "texto_locucao": {
          "type": "string"
        }
      }
    }
  }
}
