{
  "schema_version": "Manifesto.1",
  "fps": 30,
  "width": 1920,
  "height": 1080,
  "nos": [
    {
      "id": "n-001",
      "schema": "Cabecalho.1",
      "type": "cabecalho",
      "duracao_frames": -10,
      "texto": "Titulo"
    }
  ],
  "cenas": [
    { "id": "cena-001", "nos": ["n-001"] }
  ]
}